description,effective_domain_size,goshv,intersection_size,intersections,name,native,p_value,parents,precision,query,query_size,recall,significant,source,term_size,source_order,group_id
"""Any process that modulates the frequency, rate or extent of a cellular process, any of those that are carried out at the cellular level, but are not necessarily restricted to a single cell. For example, cell communication occurs among more than one cell, but occurs at the cellular level."" [GOC:go_curators]",21925,23244,13,"[['IEA'], ['IEA'], [], ['IEA'], ['IDA', 'IMP', 'TAS', 'IEA'], [], ['IDA', 'IMP', 'IEA'], ['TAS'], ['IEA'], ['IEA'], ['IMP', 'IEA'], [], ['IGI'], [], [], ['TAS'], [], [], ['IMP'], ['IDA', 'IEA']]",regulation of cellular process,GO:0050794,0.015165398706596217,"['GO:0009987', 'GO:0050789']",0.65,query_1,20,0.002770083102493075,True,GO:BP,4693,13090,5
"""The volume enclosed by the nuclear inner membrane."" [GOC:mah, GOC:pz]",20029,37388,6,"[[], [], [], [], ['IDA', 'IEA'], [], [], [], [], [], [], [], ['IDA', 'IEA'], ['IDA', 'IEA'], ['IDA', 'IEA'], [], [], ['IDA', 'IEA'], ['IEA'], []]",nuclear lumen,GO:0031981,0.01676211632247676,"['GO:0005634', 'GO:0070013']",0.3157894736842105,query_1,19,0.0056925996204933585,True,GO:CC,1054,1198,4
"""Binding to DNA of a specific nucleotide composition, e.g. GC-rich DNA binding, or with a specific sequence motif or type of DNA e.g. promotor binding or rDNA binding."" [GOC:jl]",22878,5280,6,"[['IPI', 'IEA'], ['IDA', 'IPI'], [], ['IEA'], [], [], [], [], ['IPI'], ['IPI'], [], [], [], [], [], [], [], [], [], ['IPI', 'IEA']]",sequence-specific DNA binding,GO:0043565,0.020252831995999487,['GO:0003677'],0.3157894736842105,query_1,19,0.005780346820809248,True,GO:MF,1038,5280,1
"""The joining together of exons from one or more primary transcripts of messenger RNA (mRNA) and the excision of intron sequences, via a spliceosomal mechanism, so that mRNA consisting only of the joined exons is produced."" [GOC:krc, ISBN:0198506732, ISBN:0879695897]",21925,10275,4,"[[], [], [], [], [], [], [], [], [], [], [], ['TAS'], ['ISS'], ['TAS'], ['TAS'], [], [], [], [], []]","mRNA splicing, via spliceosome",GO:0000398,0.020752956030955734,"['GO:0000377', 'GO:0006397']",0.2,query_1,20,0.017937219730941704,True,GO:BP,223,121,5
"""Splicing of RNA via a series of two transesterification reactions with a bulged adenosine residue from the intron branch point as the initiating nucleophile. When the initial RNA for the splicing reaction is a single molecule (cis splicing), the excised intron is released in a lariat structure."" [GOC:krc, PMID:11377794]",21925,10263,4,"[[], [], [], [], [], [], [], [], [], [], [], ['TAS'], ['ISS'], ['TAS'], ['TAS'], [], [], [], [], []]","RNA splicing, via transesterification reactions with bulged adenosine as nucleophile",GO:0000377,0.032361258115523706,['GO:0000375'],0.2,query_1,20,0.016,True,GO:BP,250,109,5
"""Splicing of RNA via a series of two transesterification reactions."" [GOC:krc]",21925,10261,4,"[[], [], [], [], [], [], [], [], [], [], [], ['TAS'], ['ISS'], ['TAS'], ['TAS'], [], [], [], [], []]","RNA splicing, via transesterification reactions",GO:0000375,0.032361258115523706,['GO:0008380'],0.2,query_1,20,0.016,True,GO:BP,250,107,5
"""Any process that modulates the frequency, rate or extent of a biological process. Biological processes are regulated by many means; examples include the control of gene expression, protein modification or interaction with a protein or substrate molecule."" [GOC:ai, GOC:go_curators]",21925,23240,13,"[['IEA'], ['IEA'], [], ['TAS', 'IEA'], ['IDA', 'IMP', 'IGI', 'TAS', 'IEA'], [], ['IDA', 'IMP', 'IEA'], ['TAS'], ['IEA'], ['IEA'], ['IMP', 'IEA'], [], ['IGI'], [], [], ['TAS'], [], [], ['IMP'], ['IDA', 'IMP', 'IEA']]",regulation of biological process,GO:0050789,0.03867840924507566,"['GO:0008150', 'GO:0065007']",0.65,query_1,20,0.002548020384163073,True,GO:BP,5102,13086,5
"""The series of events in which a stimulus is received by a cell or organism and converted into a molecular signal."" [GOC:add, GOC:ai, GOC:dph, GOC:mah]",21925,23786,3,"[[], [], [], [], ['IMP'], [], ['IMP', 'IEA'], [], [], [], ['IMP', 'IEA'], [], [], [], [], [], [], [], [], []]",detection of stimulus,GO:0051606,0.03979457803572447,['GO:0050896'],0.15,query_1,20,0.031578947368421054,True,GO:BP,95,13632,6
"""The enclosed volume within a sealed membrane or between two sealed membranes. Encompasses the volume enclosed by the membranes of a particular organelle, e.g. endoplasmic reticulum lumen, or the space between the two lipid bilayers of a double membrane surrounding an organelle, e.g. nuclear envelope lumen."" [GOC:add, GOC:mah]",20029,37383,6,"[[], [], [], [], ['IDA', 'IEA'], [], [], [], [], [], [], [], ['IDA', 'IEA'], ['IDA', 'IEA'], ['IDA', 'IEA'], [], [], ['IDA', 'IEA'], ['IEA'], []]",membrane-enclosed lumen,GO:0031974,0.040868938943985064,['GO:0110165'],0.3157894736842105,query_1,19,0.004819277108433735,True,GO:CC,1245,1193,4
"""The internal volume enclosed by the membranes of a particular organelle; includes the volume enclosed by a single organelle membrane, e.g. endoplasmic reticulum lumen, or the volume enclosed by the innermost of the two lipid bilayers of an organelle envelope, e.g. nuclear lumen."" [GOC:jl, GOC:mah]",20029,38037,6,"[[], [], [], [], ['IDA', 'IEA'], [], [], [], [], [], [], [], ['IDA', 'IEA'], ['IDA', 'IEA'], ['IDA', 'IEA'], [], [], ['IDA', 'IEA'], ['IEA'], []]",organelle lumen,GO:0043233,0.040868938943985064,"['GO:0031974', 'GO:0043226']",0.3157894736842105,query_1,19,0.004819277108433735,True,GO:CC,1245,1847,4
"""An organelle lumen that is part of an intracellular organelle."" [GOC:mah]",20029,38524,6,"[[], [], [], [], ['IDA', 'IEA'], [], [], [], [], [], [], [], ['IDA', 'IEA'], ['IDA', 'IEA'], ['IDA', 'IEA'], [], [], ['IDA', 'IEA'], ['IEA'], []]",intracellular organelle lumen,GO:0070013,0.040868938943985064,"['GO:0043229', 'GO:0043233']",0.3157894736842105,query_1,19,0.004819277108433735,True,GO:CC,1245,2334,4
"""The selective, non-covalent, often stoichiometric, interaction of a molecule with one or more specific sites on another molecule."" [GOC:ceb, GOC:mah, ISBN:0198506732]",22878,1450,19,"[['IDA', 'IPI', 'IEA'], ['IDA', 'IPI', 'IEA'], [], ['IPI', 'IEA'], ['IDA', 'IPI', 'IEA'], ['IEA'], ['IPI'], ['IEA'], ['IPI', 'IEA'], ['IPI', 'IEA'], ['IPI'], ['IDA', 'IEA'], ['IPI', 'IEA'], ['IDA', 'IPI', 'IEA'], ['IDA', 'HDA', 'IEA'], ['IEA'], ['IEA'], ['IDA', 'IPI', 'HDA', 'IEA'], ['IPI', 'IEA'], ['IPI', 'IEA']]",binding,GO:0005488,0.04531506977907235,['GO:0003674'],1.0,query_1,19,0.0012695443004142723,True,GO:MF,14966,1450,1
